Unnamed: 0,Author,Coursename,Last_updated,Lectures,Newfee,Oldfee,Rating,Sections,Time,Topic,Target,_id,Number_of_enroll
388,Châu Vĩnh Luân,Học tiếng Trung hiệu quả cấp tốc,2022-03-11,11,299000.0,499000.0,4.1,2,240,Ngoại Ngữ,"['bạn sẽ đủ vốn từ để giao tiếp tiếng trung, và nắm, được hơn 30 cấu trúc ngữ pháp cơ bản dành cho người mới bắt đầu.', 'bạn sẽ có khả năng nghe, phản xạ âm, nhận mặt chữ hán thành thạo trong phạm vi khóa học.', 'bạn sẽ có khả năng giao tiếp thành thạo trong phạm vi từ vựng và chủ đề trong khóa học.']",66f79d3af050d8d70ad247f4,87
389,Th.S Lê Thị Hồng Nhung,Tổng hợp kiến thức tiếng Anh cho trẻ 7-9 tuổi,2021-12-15,24,399000.0,999000.0,5.0,1,347,Ngoại Ngữ,"['học sinh được củng cố, nắm vững nội dung kiến thức tiếng anh cơ bản và nâng cao không chỉ trong sách giáo khoa mà cả các chủ điểm cần nắm vững ở độ tuổi của mình.', 'ghi nhớ lâu và dùng thạo những cấu trúc câu phổ biến và nâng cao, có trong sách giáo khoa và được mở rộng bên ngoài.', 'mở rộng vốn từ và cấu trúc ngữ pháp thông qua các chủ đề gắn liền với cuộc sống như gia đình, bạn bè, trường lớp.', 'được luyện cả 4 kỹ năng nghe, nói, đọc, viết cùng các tình huống phát triển khả năng tư duy của trẻ.', 'yêu thích tiếng anh hơn bởi những hình ảnh sinh động, âm thanh thú vị qua nội dung bài học sinh động.', 'quà tặng: bộ sách dạy giao tiếp cho trẻ + sách phát âm + bộ truyện tranh tiếng anh để các bạn nhỏ tìm hiểu thêm và thư giãn sau mỗi bài học.', 'được cung cấp đầy đủ kiến thức và tự tin hơn khi tham gia các kì thi ở lớp, trường cũng như các kỳ thi chuẩn quốc tế như starters, movers, flyers...', 'yêu thích tiếng anh hơn bởi những hình ảnh sinh động, âm thanh thú vị qua nội dung bài học sinh động.']",66f79d3af050d8d70ad247f5,78
390,Ngọc Nhân Nguyễn,Kiểm thử với Selenium Webdriver - JAVA,2022-02-07,35,399000.0,999000.0,5.0,6,182,Lập Trình - CNTT,"['các kiến thức học được sẽ giúp học viên biết cách kiểm thử tự động những form như đăng ký, đăng nhập.', 'học viên biết cách đọc và ghi vào excel và tập tin properties.', 'bên cạnh đó, học viên cũng biết xuất ra báo cáo đẹp mắt với hình ảnh minh họa khi kiểm thử bị sai.', 'ngoài ra, học viên sẽ biết cách triển khai dự án của mình lên jenkin và gửi email đến gmail.com sau khi việc kiểm thử xong.', 'học viên có thể xem lại video và code mẫu để biết cách làm từng bước.']",66f79d3af050d8d70ad247f6,73
391,Hồ Trọng Huy,Kỹ xảo phim với After Effect cho nghề dựng phim,2021-12-15,30,299000.0,599000.0,5.0,5,243,Nhiếp Ảnh - Dựng Phim,"['thực hiện tốt các clip intro, hình hiệu các chương trình truyền hình', 'các học viên sẽ tự tin hơn trong việt thực hiện các trailer phim', 'việc thực hiện kỹ xảo cho tvc sẽ dễ dàng và hiệu quả hơn']",66f79d3af050d8d70ad247f7,30
392,Hồ Trọng Huy,Dựng phim cho ngành truyền thông,2022-05-08,19,299000.0,549000.0,4.2,3,168,Nhiếp Ảnh - Dựng Phim,"['các học viên sẽ có những kiến thức cơ bản về các nguyên lý trong điện ảnh, truyền hình', 'hiểu được quy trình sản xuất của một ekip để làm nên một tác phẩm phim', 'làm được những sản phẩm hàng ngày trong một công ty truyền thông hay một kênh truyền hình', 'nắm được những kiến thức nền tảng khi đi xin việc dựng phim']",66f79d3af050d8d70ad247f8,65
393,Lê Thạch Ngọc,Khóa học giao dịch Forex,2022-06-13,24,399000.0,699000.0,4.2,2,168,Đầu Tư,"['học viên sẽ được trang bị những kiến thức cần thiết về thị trường ngoại hối.', 'học viên có thể bắt đầu giao dịch độc lập, làm việc cho chính mình và kiếm tiền trên thị trường tài chính.', 'có thể làm việc cùng với 1 trong những dự án mà giảng viên đang tham gia.', 'nắm chắc kiến thức từ cơ bản đến nâng cao, tự tin trade tài khoản cá nhân ra lợi nhuận.']",66f79d3af050d8d70ad247f9,86
394,Nguyễn Thị Thanh Mai,[EduVIP] Tự tin giao tiếp trước đám đông,2022-04-07,75,399000.0,1099000.0,4.5,15,317,Phát Triển Bản Thân,"['sau khóa học, học viên sẽ có thể tự sửa được các lỗi trong giọng nói của mình: từ ngọng n - l, tr - ch...đến giọng địa phương.', 'ngoài ra, bạn sẽ có được giọng nói truyền cảm, cuốn hút. từ đó sẽ tạo được thiện cảm với người đối diện.', 'các bé trong giai đoạn tập nói sẽ được bố mẹ hướng dẫn cách phát âm sao cho chuẩn nhất, tránh sau này phải học lại những kiến thức cơ bản đó.', 'với học sinh, sinh viên, các bạn sẽ tha hồ tự tin bày tỏ quan điểm trước lớp, trước thầy cô. từ đó xây dựng bài học hiệu quả hơn, trau dồi khả năng phản biện và tư duy vấn đề.', 'nhân viên công sở sẽ biết cách tạo thiện cảm với đồng nghiệp, các ý kiến đưa ra trong cuộc họp được các sếp ghi nhận.', 'các bạn đang nhen nhóm ý định hay có ước mơ trở thành mc sẽ có nền tảng vững chắc trên con đường nhiều hoa hồng nhưng cũng đầy chông gai này.']",66f79d3af050d8d70ad247fa,11
395,Lưu Trọng Nhân,Thiết kế UI/UX với Figma,2022-06-21,26,299000.0,599000.0,4.5,6,160,Thiết Kế,"['nắm được cách dùng công cụ và ngôn ngữ thiết kế của nó, cách tư duy bài bản để hiện thực hóa được ý tưởng thiết kế của mình.', 'kiến thức về cách tạo ra các component để tái sử dụng, giảm thời gian làm các công việc lặp tới lặp lui đến 60%.', 'những kỹ năng sử dụng figma có thể được áp dụng để làm ra các thiết kế website/ app, làm việc cá nhân dạng freelancer với khách hàng, làm việc trong một team thiết kế hoặc team lập trình ở một công ty chuyên về xây dựng website.']",66f79d3af050d8d70ad247fb,21
396,Trịnh Duy Đông,Thiết kế bản vẽ kỹ thuật với AutoCAD 2D,2022-03-29,47,399000.0,699000.0,4.4,4,427,Thiết Kế,"['được cung cấp kiến thức và kỹ năng từ cơ bản đến đến nâng cao.', 'có thể thực hiện được các bản vẽ theo ý muốn.']",66f79d3af050d8d70ad247fc,56
397,Phi Thanh Vân,Bí quyết thoát ế cho nữ FA,2022-06-12,11,399000.0,1699000.0,5.0,5,91,Hôn Nhân - Gia Đình,"['sau khóa học, các bạn nữ đang fa hiểu được mình cần làm gì và làm như thế nào để có thể tìm được một nửa cho mình mà không mắc phải những sai lầm.']",66f79d3af050d8d70ad247fd,73
398,Kiwi Ngô Mai Trang,"[EduVIP] Trở thành ""vua bếp đỉnh cao"" cho người bận rộn",2021-12-15,21,399000.0,999000.0,5.0,5,139,Nghệ Thuật - Đời Sống,"['sau khóa học, học viên sẽ nắm cơ bản kiến thức đồ âu, có thể nấu và trình bày một số món âu với trang trí đẹp bắt mắt và ngon miệng.', 'hiểu rõ một số món ăn việt nổi tiếng, có thể phân tích, đánh giá và nấu ngon miệng những món ăn thông dụng.', 'bạn sẽ trở nên yêu thích nấu ăn hơn và nhanh chóng trở thành ngôi sao nấu ăn trong mắt bạn bè gia đình.', 'thường xuyên nấu ăn với đam mê được truyền cảm hứng từ khóa học, bạn sẽ trở thành vua đầu bếp trong mắt mọi người xung quanh.']",66f79d3af050d8d70ad247fe,12
399,Đình Khánh Đoàn,Hành trình tự tin cùng chứng khoán,2022-04-17,31,299000.0,399000.0,4.5,6,97,Đầu Tư,"['xác lập được mục tiêu đúng đắn khi tham gia đầu tư chứng khoán.', 'nắm được cốt lõi cách tư duy hợp lý.', 'tâm lý vững chắc, tự tin quyết định trong mỗi giao dịch.', 'cách tối ưu hóa lợi nhuận.', 'mua - bán với tâm thái an lạc, thoải mái.', 'chia sẻ cộng đồng.']",66f79d3af050d8d70ad247ff,5
400,Trương Văn Hòa,12 Bước viết kịch bản bán hàng đỉnh cao,2022-04-03,16,299000.0,499000.0,4.6,1,103,Marketing,"['bạn sẽ dễ dàng xây dựng được nội dung bán hàng thu hút hiệu quả tỷ lệ chuyển đổi cao mà không cần bạn phải là chuyên gia.', 'bạn sẽ dễ dàng xây dựng được nội dung bán hàng thu hút hiệu quả tỷ lệ chuyển đổi cao mà không cần bạn phải là chuyên gia. chỉ với duy nhất 1 giờ đồng hồ, bạn sẽ có khả năng giống như một người đã viết quảng cáo hơn 6 năm.', 'từng đồng chi phí marketing bạn bỏ ra sẽ giúp bạn gia tăng gấp đôi thậm chí gấp 3 lần đơn hàng.từng đồng chi phí marketing bạn bỏ ra sẽ giúp bạn gia tăng gấp đôi thậm chí gấp 3 lần đơn hàng.', 'không cần phải đau đầu sáng tạo nội dung nữa, chỉ cần làm theo công thức bạn dễ dàng có được kịch bản bán hàng tuyệt đỉnh.', 'chạm được đến cảm xúc của khách hàng, khiến cho khách hàng thèm muốn mua sản phẩm của bạn.']",66f79d3af050d8d70ad24800,36
401,Công Tuấn Anh Nguyễn,Chinh phục từ vựng Tiếng Anh 4.0,2022-05-02,12,399000.0,1049000.0,5.0,4,106,Ngoại Ngữ,"['nắm được cách tra từ điển để học từ vựng tối ưu.', 'tự biết cách trau dồi vốn từ vựng tiếng anh sao cho hiệu quả.', 'nắm được cách sử dụng một số công cụ online hỗ trợ cho việc học từ vựng trên tinh thần của thời đại 4.0.']",66f79d3af050d8d70ad24801,21
402,Trương Văn Hòa,Tăng năng suất công việc với Trello,2022-05-08,19,299000.0,549000.0,4.3,4,121,Tin Học Văn Phòng,"['thông qua trello, khóa học giúp bạn quản trị công việc hiệu quả, hoàn thành chinh phục mục tiêu với phương pháp chia nhỏ công việc, với ứng dụng trello bạn hoàn toàn kiểm soát công việc ngay trên máy tính, điện thoại của mình, bạn sẽ có thêm nhiều thời gian hơn, tốn ít công sức hơn, làm việc ở bất kỳ nơi đâu bạn muốn với ứng dụng trello.', 'quản trị công việc là một trong những kỹ năng quan trọng nhất giúp bạn gia tăng năng suất, hoàn thành những mục tiêu để thành công và hạnh phúc, đăng ký ngay tham gia khóa học tuyệt vời này.', 'biết cách quản trị công việc hiệu quả.', 'hoàn thành chinh phục mục tiêu với phương pháp chia nhỏ công việc.', 'tăng năng suất công việc gấp 3 lần với trello với bài giảng giá trị cao dành cho bạn để bứt phá công việc thành công vượt trội tối ưu thời gian.', 'làm việc hiệu quả để thành công, có nhiều thời gian để hưởng thụ cuộc sống ý nghĩa này.']",66f79d3af050d8d70ad24802,56
403,Trương Văn Hòa,32 Tuyệt chiêu gia tăng doanh số,2022-05-08,31,299000.0,549000.0,3.9,4,199,Kinh Doanh - Khởi Nghiệp,"['trong khóa học bạn sẽ biết cách làm thế nào để thu hút hơn 3000 ngàn khách hàng tiềm năng vào website của bạn mỗi ngày, làm thế nào để tăng tỷ lệ mua hàng lần đầu tiên, đặc biệt tôi sẽ tiết lộ với bạn bí quyết để giữ chân đến 98% khách hàng ở lại với bạn trước khi họ tắt website của bạn đi, để bạn có cơ hội tiếp tục chăm sóc và khách hàng sẽ quay trở lại website để mua hàng từ bạn chứ không phải mua từ đối thủ.', 'bí quyết để từ một người bình thường mới bắt đầu trở thành chuyên gia bán hàng online:', '+ chọn thị trường ngách tăng lợi thế cạnh tranh bán hàng.', '+ gia tăng lưu lượng khách hàng tiềm năng.', '+ gia tăng tỷ lệ bán hàng ngay từ lần đầu tiên.', '+ chăm sóc khách hàng từ không mua trở thành mua hàng.', '+ làm thế nào để khách hàng đi giới thiệu và bán hàng cho bạn.']",66f79d3af050d8d70ad24803,92
404,Edumall,[EDUVIP] Giải mã IELTS Writing cùng Izone trong 30 ngày,2021-12-15,32,399000.0,1199000.0,5.0,3,455,Other,"['sau khi hoàn thiện khóa học, học viên sẽ đạt được những kết quả sau : tăng ít nhất 1 band score cho phần thi writing sau quá trình học.', 'hiểu rõ cấu trúc của từng câu, từng đoạn trong academic writing.', 'biết cách phân tích cấu trúc tổng thể. biết cách chia đoạn vừa đơn giản, lại vừa hiệu quả.', 'biết cách triển khai một đoạn văn theo academic style/semi-academic style trong tiếng anh', 'phát triển khả năng tự xác định lỗi (đặc biệt là các lỗi liên quan đến ngữ pháp trong khi viết)', 'nắm rõ được khả năng học topic-related vocabulary (từ vựng liên quan đến topics) để học lâu dài.']",66f79d3af050d8d70ad24804,17
405,Edumall,[EduVIP] Để trẻ không trở thành nạn nhân của xâm hại tình dục,2022-02-17,32,399000.0,1199000.0,5.0,7,171,Other,"['sau khi hoàn thành khóa học, người học có được những kiến thức căn bản về bảo vệ trẻ em và phòng tránh xâm hại tình dục trẻ em.', 'học viên phân biệt được đụng chạm an toàn - đụng chạm không an toàn và cách hướng dẫn trẻ phân biệt.', 'người học có được thông tin về các điều luật, các tổng đài hỗ trợ liên quan đến xâm hại tình dục trẻ em.', 'nội dung khóa học giúp phụ huynh có thể sử dụng để hướng dẫn và đồng hành cùng con bảo vệ bản thân.', 'giáo viên có thể sử dụng trong các giờ sinh hoạt ngoại khóa để hướng dẫn học sinh.', 'cán bộ quản lý có thể sử dụng cho các buổi tuyên truyền phòng tránh xâm hại tại địa phương.']",66f79d3af050d8d70ad24805,47
406,Bùi Quang Cường,[EduVIP] Truyền nghề Facebook Marketing A - Z phiên bản 2019,2022-05-04,104,399000.0,1099000.0,5.0,11,574,Marketing,"['học viên sẽ biết cách tư duy tối ưu quảng cáo từ một agency hàng đầu.', 'thành thạo các kỹ năng về cài đặt facebook ads mới nhất năm 2019.', 'biết những bí quyết viết content chất lượng ngay cả khi bạn không phải là người sáng tạo.', 'biết những cách đo lường, đánh giá, tối ưu hiệu quả quảng cáo cập nhật.', 'khóa học có những case study thực tế giúp việc học trở nên dễ hiểu và áp dụng thành công.', 'học viên sẽ được hỗ trợ online sau khoá học.']",66f79d3af050d8d70ad24806,42
407,Liat Rockah Zimroni,Dạy con phát triển toàn diện theo phương pháp của người Do Thái,2022-05-09,29,399000.0,699000.0,5.0,15,112,Hôn Nhân - Gia Đình,"['hiểu rõ và áp dụng các công cụ giáo dục hiệu quả để nuôi dạy trẻ.', 'có được những giải pháp đối với các vấn đề khó khăn phụ huynh thường gặp phải trong việc nuôi dạy trẻ.', 'nắm bắt được phương thức để các bậc phụ huynh tạo ra những thói quen tốt cho trẻ nhỏ.', 'dạy trẻ biết cách thư giãn và tập trung khi cần.', 'biết cách tạo nên một môi trường hoàn hảo để giáo dục trẻ biết cách yêu thương và tôn trọng lẫn nhau.']",66f79d3af050d8d70ad24807,80
408,Dương Thị Thanh Hương,Kỹ năng làm việc hiệu quả,2022-03-24,36,399000.0,799000.0,5.0,10,90,Phát Triển Bản Thân,"['• tăng hiệu quả công việc, hoàn thành công việc nhiều hơn trong thời gian ngắn hơn.', '• có nhiều thời gian hơn dành cho bản thân và gia đình.', '• cải thiện sức khỏe, giảm căng thẳng stress.', '• tìm được niềm vui trong công việc của mình.', '• tạo ra nhiều giá trị hơn từ đó có thu nhập cao hơn và nhiều cơ hội thăng tiến hơn.']",66f79d3af050d8d70ad24808,64
409,Joseph William Thumpston (Joe),[EduVIP] Cùng học tiếng Anh giao tiếp với thầy Bản xứ,2022-04-28,36,399000.0,1199000.0,4.7,8,182,Ngoại Ngữ,"['học viên được tiếp xúc thực hành nghe từ thầy bản xứ. từ đó nắm rõ cách phát âm chuẩn anh - anh.', 'khóa học giúp các bạn mất gốc hoàn toàn vẫn tự tin giao tiếp tiếng anh chỉ sau mỗi chương học.', 'với các chủ đề giao tiếp quen thuộc, bạn sẽ không còn ngại mỗi khi giao tiếp với ngôn ngữ này nữa.']",66f79d3af050d8d70ad24809,44
410,Edumall,Digital Marketing Fundamental,2022-06-09,53,399000.0,1099000.0,4.3,10,121,Other,"['sau khóa học, học viên sẽ:', 'nắm được các kiến thức căn bản và tổng quan nhất về digital marketing.', 'biết cách phân loại công cụ digital marketing, từ website, social, media, email marketing đến digital campaign và kpi.', 'có thể áp dụng để lập ngay kế hoạch digital marketing cho công ty/ nhãn hàng của chính mình.']",66f79d3af050d8d70ad2480a,82
411,Phạm Minh Tiến,[EduVIP] 4 Bước cốt lõi xây dựng team marketing từ zero tới hero,2021-12-15,39,399000.0,1199000.0,5.0,16,143,Marketing,"['giúp founder/manager biết cách huấn luyện nhân viên trở nên giỏi hơn mình mà không tốn nhiều thời gian.', 'giúp founder/manager giảm tải 70% công việc quản lý vụn vặt, để tập trung vào những công việc cấp cao hơn như suy nghĩ hướng marketing mới, lên kế hoạch...', 'biết cách làm cho nhân viên ngày càng trở nên sáng tạo hơn, không còn lo cảnh bị cạn kiệt ý tưởng sau một thời gian chạy ads nữa.', 'giúp founder/manager tận dụng được trí tuệ nhân viên, tránh được cảnh ""một mình phải suy nghĩ hộ cả team"" như hiện tại.', 'biết cách làm cho nhân viên trở nên am hiểu về khách hàng, thị trường như mình.', 'biết cách khiến nhân viên ngày càng tự chủ động hơn trong công việc hàng ngày, không còn lệ thuộc vào founder/manager nữa.', 'biết cách làm cho nhân viên tự biết cách gọt giũa, chọn lọc các ý tưởng của họ, giảm các ý tưởng không khả thi hoặc nhàm chán đi.', 'giúp founder/manager biết cách lựa chọn những nhân sự còn non kinh nghiệm nhưng có thể phát triển được.']",66f79d3af050d8d70ad2480b,34
412,Đỗ Kim Thu,Bí mật của hạnh phúc (Phần 2),2021-12-15,53,299000.0,599000.0,5.0,2,123,Phát Triển Bản Thân,"['các bạn học viên nhận ra rằng hạnh phúc không phải là điều xa xôi khó tìm.', 'hạnh phúc có thể tìm được bằng những điều chỉnh, những thay đổi trong cuộc sống, cách nhìn của mỗi chúng ta.', 'hạnh phúc có thể tìm được trong sự chia sẻ chân thành,trong cách tư duy... hướng tới một ngày mai tốt đẹp.']",66f79d3af050d8d70ad2480c,32
413,Đỗ Kim Thu,Bí mật của hạnh phúc (Phần 1),2021-12-15,46,299000.0,599000.0,5.0,2,124,Thể Thao - Sức Khỏe,"['các bạn học viên nhận ra rằng hạnh phúc không phải là điều xa xôi khó tìm.', 'hạnh phúc có thể tìm được bằng những điều chỉnh, những thay đổi trong cuộc sống, cách nhìn của mỗi chúng ta.', 'hạnh phúc có thể tìm được trong sự chia sẻ chân thành,trong cách tư duy... hướng tới một ngày mai tốt đẹp.']",66f79d3af050d8d70ad2480d,54
414,Nguyễn Hoàng Phúc,Khóa Học Guitar FingerStyle Cho Người Mới Bắt Đầu,2022-04-22,52,299000.0,599000.0,4.0,11,272,Âm Nhạc,"['chơi ngẫu hứng và đệm hát bài bất kỳ theo phong cách fingerstyle.', 'nắm bắt những kỹ thuật và kỹ năng xử lý bằng fingerstyle.', 'tự dò tone, dò giai điệu và hợp âm cho bài hát từ đó có thể tự đệm và solo một bài hát.', 'soạn fingerstyle những bài hát yêu thích.', 'nắm vững nhạc lý: cách đọc tọa độ, bấm hợp âm, tiết tấu; cách rải âm và quạt chả.', 'thành thạo các điệu cơ bản: slow, surf nhanh - chậm, disco, blue, ballad,...']",66f79d3af050d8d70ad2480e,55
415,Nguyễn Phước Thịnh,Gội sấy dưỡng sinh tiêu chuẩn,2021-12-15,14,399000.0,1899000.0,5.0,2,90,Nghệ Thuật - Đời Sống,"['kỹ năng, kiến thức cần thiết trong gội đầu, gội đầu dưỡng sinh, rửa mặt massage mặt, massage cổ vai gáy giúp thư giãn giảm căng thẳng mệt mỏi.', 'kỹ thuật chia phân khu sấy tạo kiểu tiêu chuẩn các mẫu tóc ứng dụng hàng ngày.', 'hiểu và thực hành đúng kỹ năng, kỹ thuật massage gội dưỡng sinh, bấm huyệt.']",66f79d3af050d8d70ad2480f,63
416,Jen Vuhuong,Turn failure into action (Chuyển thất bại thành hành động),2021-12-15,5,399000.0,799000.0,5.0,2,41,Phát Triển Bản Thân,"['tư duy và cách nhìn nhận mang tính chủ động và dẫn đến hành động.', 'những kỹ thuật để củng cố niềm tin vào khả năng vượt lên thất bại.', 'những chiến lược để duy trì và củng cố niềm tin và động lực để hành động mỗi ngày.']",66f79d3af050d8d70ad24810,12
417,Nguyễn Hoàng Phúc,Khóa học Guitar FingerStyle nâng cao,2022-04-22,50,299000.0,599000.0,5.0,9,237,Âm Nhạc,"['chơi ngẫu hứng và đệm hát bài bất kỳ theo phong cách fingerstyle.', 'nắm bắt những kĩ thuật và kĩ năng xử lý bằng fingerstyle.', 'tự dò tông, dò giai điệu và hợp âm cho bài hát từ đó có thể tự đệm và solo một bài hát.', 'soạn fingerstyle những bài hát yêu thích.', 'học viên soạn ra tab guitar pro những bài hát yêu thích, hoặc soạn cho người khác.', 'học viên có thể chuyển soạn fingerstyle những bài hát yêu thích, những bài fingerstyle nổi tiếng.']",66f79d3af050d8d70ad24811,73
418,Jen Vuhuong,Overcome laziness (Vượt lên sự lười biếng),2021-12-15,5,399000.0,799000.0,5.0,1,30,Phát Triển Bản Thân,"['sau khóa học, học viên sẽ biết cách làm chủ bản thân, không còn thói quen trì hoãn và lười biếng. thay vào đó, học viên sẽ tự biết cách tạo động lực làm việc mỗi ngày', 'lý do cốt lõi của sự lười biếng.', 'kỹ thuật làm chủ buổi sáng.', 'kỹ thuật blocktime để xác định việc cụ thể cần làm.', 'kỹ thuật raising necessity - tăng sự cần thiết của việc thực hiện hành động.']",66f79d3af050d8d70ad24812,52
419,Trần Thị Thanh Ngân,Bí kíp tăng 50% điểm nghe JLPT trong vòng 1 tháng- cấp độ N5,2022-06-05,30,299000.0,599000.0,5.0,5,178,Ngoại Ngữ,"['nắm vững cách thức, phương pháp cũng như các mẹo tối ưu để làm một đề thi chuẩn và hiệu quả trong phần nghe hiểu.', 'hỗ trợ bạn đạt đến năng lực tiềm thức để giải bất kì đề thi nào trong trạng thái tự tin nhất.', 'tiện lợi, tiết kiệm thời gian, tiền, công sức...vì không cần đi đến các trung tâm để ôn luyện.', 'tăng 50% điểm nghe jlpt nếu bạn cam kết thực hành theo lời hướng dẫn một cách nhuần nhuyễn và tăng cường rèn luyện liên tục suốt từ trên 30 ngày.']",66f79d3af050d8d70ad24813,40
420,Edumall,[EduVIP] Trở thành DJ chuyên nghiệp trong 7 ngày,2021-12-15,49,399000.0,899000.0,5.0,12,199,Other,"['sau khóa học, học viên sẽ biết cách xây dựng hình ảnh, lên kế hoạch tiếp thị, tự tìm kiếm khách hàng, định hướng nghề nghiệp trong tương lai.', 'học viên sẽ đảm nhận được nhiều vai trò như: biên tập, đạo diễn, giám đốc sản xuất...', 'học viên có thể trở thành dj chuyên nghiệp, có thể sử dụng nhiều hiệu ứng để sáng tạo ra những bản nhạc tuyệt vời.']",66f79d3af050d8d70ad24814,59
421,Lê Trần Ánh Ngọc,[EduVIP] Hướng dẫn nấu thực đơn ăn kiêng low carb ngon nhất,2022-04-02,28,399000.0,999000.0,5.0,5,153,Thể Thao - Sức Khỏe,"['sau khóa học các bạn sẽ có nền tảng kiến thức căn bản về chế độ lowcarb, bao gồm: nguyên lý hoạt động, cơ chế giảm cân, nguyên tắc áp dụng lowcarb vào đời thường, giúp tăng cường sức khỏe, cải thiện vóc dáng, giảm đáng kể tỉ lệ mỡ cơ thể và mỡ nội tạng.', 'học viên có khả năng nấu các món ăn lowcarb từ cơ bản đến nâng cao.', 'học viên biết được nguyên tắc chuyển đổi công thức bánh thường thành lowcarb, mở rộng kiến thức hơn về lowcarb.']",66f79d3af050d8d70ad24815,49
