Unnamed: 0,Author,Coursename,Last_updated,Lectures,Newfee,Oldfee,Rating,Sections,Time,Topic,Target,_id,Number_of_enroll
787,Đặng Quang Vũ,Bí quyết giao tiếp ứng xử trong công việc,2021-12-15,36,399000.0,699000.0,5.0,5,133,Phát Triển Bản Thân,"['tìm ra vấn đề trong các tình huống giao tiếp trong công việc.', 'biết cách ứng xử và giải quyết vấn đề một cách phù hợp.', 'chuyển hóa tình hình giao tiếp bất ổn thành thuận lợi.', 'trở thành con người giỏi giao tiếp.']",66f79d3af050d8d70ad24983,99
788,Đặng Quang Vũ,Bí quyết giao tiếp ứng xử trong nhà trường và gia đình,2021-12-15,37,399000.0,699000.0,5.0,3,136,Phát Triển Bản Thân,"['tìm ra vấn đề trong các tình huống giao tiếp trong nhà trường và gia đình.', 'biết cách ứng xử và giải quyết vấn đề một cách phù hợp.', 'chuyển hóa tình hình giao tiếp bất ổn thành thuận lợi.', 'trở thành con người giỏi giao tiếp.']",66f79d3af050d8d70ad24984,88
789,Đặng Quang Vũ,Chiến lược dành cho học tập,2022-03-04,40,399000.0,699000.0,4.1,7,174,Phát Triển Bản Thân,"['có được những lời khuyên bổ ích trong học tập.', 'biết được những chiến lược khoa học, hợp lý trong các quá trình: học trên lớp, tự học, đọc sách, ôn thi, khi đi thi...', 'rèn luyện tư duy và tác phong học tập đúng đắn.']",66f79d3af050d8d70ad24985,77
790,Trần Hữu Duy,KĨ THUẬT NUÔI ONG MẬT CỰC CHUẨN,2022-06-02,16,299000.0,599000.0,3.9,1,92,Kinh Doanh - Khởi Nghiệp,"['kĩ thuật nuôi ong mật cực chuẩn.', 'gồm 15 bài giảng chi tiết, thiết thực, cụ thể dành cho bà con nông dân.']",66f79d3af050d8d70ad24986,69
791,Trần Đình Dần (Master Trần),KHÓA HỌC LÀM VIDEO HOẠT HÌNH KIẾM TIỀN YOUTUBE VỚI CAMTASIA,2021-12-15,32,399000.0,799000.0,5.0,1,213,Nhiếp Ảnh - Dựng Phim,"['bạn sẽ làm được video phim hoạt hình 2d chuyên nghiệp giúp bạn kiếm tiền trên youtube, ngoài ra kiến thức còn hỗ trợ bạn rất nhiều cho phát triển hệ thống marketing trên youtube.']",66f79d3af050d8d70ad24987,50
792,Lê Hải,Massage for lover,2022-04-25,26,399000.0,799000.0,5.0,1,115,Hôn Nhân - Gia Đình,"['kĩ thuật massage for lover, massage gia đình', 'cách tạo dựng phòng massage', 'chuẩn bị trước khi massage', 'kĩ thuật đúng và kĩ thuật sai']",66f79d3af050d8d70ad24988,72
793,Trần Đình Dần (Master Trần),"Trọn bộ làm video và kỹ xảo chuyên nghiệp với Premiere Pro CC, After Effects và Proshow Producer",2022-03-09,95,399000.0,699000.0,4.1,4,712,Nhiếp Ảnh - Dựng Phim,"['bạn sẽ biết sử dụng camera để tạo ra những thước phim quảng cáo tuyệt đẹp.', 'bạn được trang bị những kiến thức vẽ đồ họa 2d chuyên nghiệp.', 'bạn chắc chắn làm được những video lung linh kỹ xảo, là tiền đề giúp bạn tiến xa hơn trong ngành kỹ xảo điện ảnh và những chuyên gia làm video marketing chuyên nghiệp.', 'sau khi hoàn thành khóa học bạn sẽ làm được phim chuyên nghiệp, talkshow truyền hình, ca nhạc, tách ghép phông xanh, motion graphics title, chỉnh màu và hiệu ứng chuyên nghiệp.', 'sau khi hoàn thành khóa học bạn sẽ tạo ra được những video slideshow - motion graphics rất nhanh chóng mà không thua kém phần mềm chuyên nghiệp.']",66f79d3af050d8d70ad24989,97
794,NGUYỄN ĐỨC CAO,LÀM SAO ĐỂ THẤU HIỂU CON TRẺ - TRÁNH XUNG ĐỘT,2021-12-15,15,399000.0,699000.0,5.0,5,119,Hôn Nhân - Gia Đình,"['sau khóa học, bố mẹ sẽ thấu hiểu con cái nhiều hơn, không khí gia đình trở nên vui vẻ, hạnh phúc.', 'ừ đó, sẽ tạo nhiều điều kiện thuận lợi để giúp con cái tự tin, thành đạt trong tương lai.']",66f79d3af050d8d70ad2498a,41
795,Trần Duy Thanh,Thành thạo ngôn ngữ lập trình C++,2022-06-28,108,399000.0,699000.0,4.5,11,1122,Lập Trình - CNTT,"['có được kiến thức toàn diện về ngôn ngữ lập trình c++.', 'là cơ sở để học tiếp các khóa: cấu trúc dữ liệu, lập trình c#, lập trình java, lập trình android....', 'làm chủ được c++ sẽ giúp học viên dễ dàng tiếp thu các ngôn ngữ mới.', 'có thể tham gia các dự án liên quan tới lập trình c++.']",66f79d3af050d8d70ad2498b,26
796,Trần Võ Như,Học giải toán Soroban,2021-12-15,39,299000.0,599000.0,5.0,6,320,Hôn Nhân - Gia Đình,"['trẻ em đạt được sự tập trung trí óc.', 'trẻ em rèn luyện trí nhớ.', 'trẻ em phát triển bán cầu não phải.', 'giúp bé nâng cao khả năng tính toán.']",66f79d3af050d8d70ad2498c,62
797,Trần Thị Phương Nga,Khóa học rau câu 3D tạo hình chim công và chim phượng hoàng,2021-12-15,11,399000.0,899000.0,5.0,2,144,Nghệ Thuật - Đời Sống,"['học viên tạo hình được những mẫu thạch bắt mắt, ngon miệng phù hợp để trang trí, làm quà tặng hoặc thưởng thức trong những ngày trời nắng nóng.', 'học viên biết tạo hình chim công và chim phượng hoàng đặc biệt.']",66f79d3af050d8d70ad2498d,74
798,Trần Đình Dần (Master Trần),LÀM VIDEO MARKETING BÁN HÀNG VỚI CAMTASIA,2021-12-15,28,399000.0,799000.0,5.0,4,236,Nhiếp Ảnh - Dựng Phim,"['bạn sẽ làm được video marketing rất chuyên nghiệp, tạo ra phim hoạt hình nhanh chóng đẹp mắt, biết cách làm ra 1000 video trong một ngày.']",66f79d3af050d8d70ad2498e,17
799,Nguyễn Đức Hải,Hướng dẫn thực hành nghiệp vụ đào tạo nội bộ tại doanh nghiệp,2022-06-23,24,399000.0,699000.0,5.0,1,144,Kiến Thức Chuyên Ngành,"['sau khóa học, học viên sẽ:', 'hiểu được các công việc cụ thể của mảng đào tạo nội bộ trong doanh nghiệp.', 'sử dụng một số công cụ trong đào tạo để lập kế hoạch cũng như xây dựng hệ thống nội dung đào tạo cho doanh nghiệp mình.', 'hiểu và xây dựng các chính sách đào tạo, quy trình đào tạo tại doanh nghiệp.', 'từng bước xây dựng chương trình đào tạo, các kỹ năng giảng dạy.']",66f79d3af050d8d70ad2498f,79
800,Thiều Kim Cường,THỰC HÀNH KẾ TOÁN XÂY DỰNG TRONG DOANH NGHIỆP,2022-06-02,34,299000.0,599000.0,4.0,8,222,Kiến Thức Chuyên Ngành,"['sau khóa học, học viên có kiến thức về xây dựng và kế toán xây dựng trên nền tảng doanh nghiệp thực tế, các nghiệp vụ kế toán đa dạng và tổng hợp.', 'áp dụng ngay trong công việc kế toán doanh nghiệp xâu dựng.', 'sau 1 thời gian làm việc và rèn luyện học viên có thể nhận thêm việc về làm kế toán dịch vụ, hoặc tìm các công ty lớn hơn.']",66f79d3af050d8d70ad24990,94
801,Nguyễn Đức Hải,6 NGUYÊN TẮC PHÁT TRIỂN NĂNG LỰC LÃNH ĐẠO,2022-05-13,17,399000.0,699000.0,5.0,2,108,Phát Triển Bản Thân,"['mổ xẻ cặn kẽ khái niệm lãnh đạo.', 'nắm được mô hình phát triển năng lực lãnh đạo.', 'vận dụng 6 nguyên tắc phát triển năng lực lãnh đạo để lập kế hoạch cho việc phát triển năng lực lãnh đạo của bản thân.']",66f79d3af050d8d70ad24991,36
802,NCS. Tiến Sĩ Nguyễn Bá Dương David Dương,Chứng khoán cho người mới bắt đầu,2022-06-24,53,399000.0,799000.0,4.3,1,327,Đầu Tư,"['những chiến lược, công thức, vũ khí đơn giản, một quy trình hành động từng bước rõ ràng, hiệu quả và thực chiến nhất.', 'các công thức kỳ diệu nhằm đầu tư đúng đắn và tạo thu nhập thụ động cho bản thân.', 'có tư duy và kỹ năng đầu tư bài bản chuyên nghiệp ngay từ đầu và phát triển bền vững.', 'giải pháp về phương pháp đầu tư chứng khoán giá trị sẽ diễn ra theo hướng tích hợp & chọn lọc những gì mạnh sẽ nhất của sự tăng trưởng.', 'bí quyết tìm doanh nghiệp tăng trưởng.', 'cách nhận diện cổ phiếu đang tăng trưởng.', 'kết nối với cộng đồng đầu tư chứng khoán.', 'bởi tôi đã chia sẻ từ những bước cơ bản nhất và sẽ cùng tương tác với bạn.', 'bạn chỉ cần đăng ký tham gia ngay thì kiến thức hơn 16 kinh nghiệm đầu tư chứng khoán của tôi sẽ thuộc về bạn.']",66f79d3af050d8d70ad24992,81
803,Thân Đức Hòa,Cách dạy con ưu việt của người Do Thái,2021-12-15,14,399000.0,799000.0,5.0,2,112,Hôn Nhân - Gia Đình,"['nếu không đầu tư vào việc học cách nuôi dạy trẻ thì với cuộc sống hiện đại bận rộn hiện nay, những đứa trẻ của chúng ta lớn lên và phát triển theo kiểu tự nhiên ""5 ăn, 5 thua"". kết quả là: một số sẽ sống vị kỷ, ỷ lại, sống ích kỷ chỉ biết đến bản thân mà không quan tâm người khác, đổ lỗi và oánh trách bố mẹ... 1 số khác nghiêm trọng hơn thì nghiện games, cờ bạc, đàn đúm bạn bè, đua đòi ...nói chung là không có mục đích sống đúng đắn và lành mạnh.', 'nếu kiên trì và tạo thành nếp sống hay thói quen có thể thay đổi cuộc đời và tương lai của con. xa hơn nữa là thay đổi cả một thế hệ.']",66f79d3af050d8d70ad24993,76
804,Vũ Tiến Thành,Học xử lý video với trọn bộ Adobe,2024-08-19,101,299000.0,490000.0,4.0,17,625,Nhiếp Ảnh - Dựng Phim,"['các thiết bị thường sử dụng để ghi hình video', 'các phần mềm để biên tập hoàn chỉnh một video', 'các hiệu ứng thường dùng trong một video', 'cách tạo các mẫu intro, outro và bar thông tin trong video', 'màu sắc và ánh sáng trong video']",66f79d3af050d8d70ad24994,71
805,Nguyễn Đức Hải,PHÁT TRIỂN BẢN THÂN - QUẢN TRỊ CUỘC ĐỜI,2021-12-15,17,399000.0,699000.0,5.0,1,111,Phát Triển Bản Thân,"['hiểu rõ được phát triển bản thân một cách toàn diện là phát triển thân - tâm - trí.', 'phương pháp lập kế hoạch cuộc đời theo từng thời kỳ. giai đoạn nào phát triển thân, giai đoạn nào phát triển tâm, giai đoạn nào phát triển trí tuệ.']",66f79d3af050d8d70ad24995,53
806,Trần Hoàng Sơn,Bảo vệ con bạn trước những nguy cơ mới,2022-04-24,18,499000.0,499000.0,4.0,2,94,Hôn Nhân - Gia Đình,"['thoát hiểm khi bị bắt cóc truyền thống, phòng tránh bắt cóc online.', 'tác hại của ma túy & phòng tránh 4 loại ma túy mới.', 'biết sử dụng 2 loại bình chữa cháy, thoát hiểm khi gặp cháy nổ.', 'nhận biết & phòng tránh xâm hại tình dục.', 'tìm hiểu về cơ thể 2 giới, em bé sinh ra từ đâu, phòng tránh các bệnh lây qua đường tình dục.', 'nhận biết và cách xử lý khi bị bạo lực học đường.']",66f79d3af050d8d70ad24996,95
807,Trung tâm Goldenlifes,Khóa học thành công,2021-12-15,31,399000.0,699000.0,5.0,1,184,Phát Triển Bản Thân,"['sau khóa học, bạn sẽ tự tin hơn trong giao tiếp và cuộc sống.', 'giúp bạn phát triển bản thân, nuôi dưỡng tiềm năng, thúc đẩy động lực để thành công và đạt được những mục tiêu của bạn.']",66f79d3af050d8d70ad24997,93
808,Trung tâm Goldenlifes,Tạo động lực bản thân,2021-12-27,74,399000.0,699000.0,5.0,1,231,Phát Triển Bản Thân,"['sau khóa học, bạn sẽ tự tin hơn trong giao tiếp và cuộc sống.', 'giúp bạn phát triển bản thân, nuôi dưỡng tiềm năng, thúc đẩy động lực để thành công và đạt được những mục tiêu của bạn.']",66f79d3af050d8d70ad24998,59
809,Lê Trí Thanh (Khánh Huỳnh),Kiếm tiền với Instagram - Xây dựng thu nhập thụ động 500$/ tháng,2022-03-12,50,399000.0,699000.0,3.9,3,231,Marketing,"['có thêm kênh thu nhập.', 'có thể thử sức trong việc kinh doanh trên instagram.', 'quảng bá sản phẩm không những ở thị trường trong nước mà cả ở thị trường quốc tế.']",66f79d3af050d8d70ad24999,45
810,Phạm Sỹ Hùng,Thiết kế biệt thự nhà phố với Revit,2022-06-06,78,349000.0,349000.0,4.0,13,632,Thiết Kế,"['hiểu về thiết kế đồ họa, thiết kế nội thất.', 'hiểu về revit và nắm chắc quy trình thực hiện dự án thực tế với revit.', 'tự tin ứng tuyển vào các công ty đang sử dụng revit.', 'có thể tự tay thiết kế các dự án nhà ở, biệt thự với phần mềm revit từ kết cấu và kiến trúc, từ thiết kế đến ra bản vẽ.', 'sử dụng thư viện revit dung lượng 17gb và hàng chục cuốn ebook về revit bim nổi tiếng.']",66f79d3af050d8d70ad2499a,82
811,Nguyễn Thích Duy Đức,Xây dựng hệ thống bán hàng tự động trên Facebook - Hệ thống tự hoàn vốn,2021-12-15,30,399000.0,799000.0,5.0,3,194,Kinh Doanh - Khởi Nghiệp,"['sau khóa học, học viên sẽ:', 'bạn sẽ biết cách thiết lập, cài đặt và vận hành hệ thống bán hàng, chăm sóc khách hàng, lưu trữ thông tin người dùng tự động trên facebook một cách tự động hóa.', 'nắm rõ được các khái niệm, mục đích của hệ thống để đưa ra các chiến lược tối ưu cho doanh nghiệp của mình.', 'xây dựng tệp data số lượng lớn, biết cách phân loại khách hàng tự động theo kịch bản có sẵn.', 'dễ dàng nhân bản, tự động hóa và đơn giản hóa công việc bán hàng.', 'ứng dụng cho tất cả các ngành nghề, sản phẩm hay dịch vụ bất kỳ.', 'về lâu dài khi vận dụng những kiến thức này bạn hoàn toàn có thể đi xây dựng 1 hệ thống tự động tương tự cho các doanh nghiệp hoặc lĩnh vực khác mà bạn muốn kinh doanh thêm.']",66f79d3af050d8d70ad2499b,65
812,Vũ Ngọc Quyền,Thương Hiệu Cá Nhân Và Phát Triển Sự Nghiệp Cho Người Đi Làm Cùng LinkedIn và Facebook,2021-12-15,25,399000.0,699000.0,5.0,1,181,Phát Triển Bản Thân,"['kết thúc khóa học, anh chị sẽ:', 'xây dựng toàn diện thương hiệu cá nhân, chia sẻ.', 'kết nối với cộng đồng nhân sự chuyên nghiệp trên linkedin và facebook :', '1. xây dựng profile facebook thu hút, chuyên nghiệp - phù hợp từng ngành nghề công việc.', '2. thiết lập tài khoản profile trên mạng xã hội kinh doanh - nhân sự linkedin đầy đủ và chuyên nghiệp với những thông tin cá nhân - công việc và kỹ năng, kinh nghiệm của anh chị.', '3. tham gia các nhóm nghề nghiệp chuyên nghiệp cùng các nhân sự chuyên nghiệp khác, tăng cường kết nối giao lưu chia sẻ kinh nghiệm và kiến thức giữa các thành viên để nâng cao kiến thức và mở rộng mối quan hệ trên facebook group và linkedin group.', '4. biết cách tuyệt vời để duy trì theo dõi các công ty bạn thích thú. càng ngày càng có nhiều công ty dùng linkedin như một đường dẫn đến các tin tức, báo chí và những bài đăng việc làm. những thông tin này hết sức bổ ích.', '5. tham gia, kết nối và truy cập kho kiến thức tuyệt vời của slideshare - một thành viên của linkedin.', '6. kết nối với toàn bộ bạn bè cùng công ty, chia sẻ và sử dụng như một mạng xã hội tương tự facebook nhưng sẽ tập trung vào việc phát triển công việc - sự nghiệp và thương hiệu cá nhân.', 'tuyển dụng nhân sự chuyên nghiệp - và ứng tuyển cho những công việc yêu thích, tìm kiếm cơ hội mở rộng mạng lưới kinh doanh, phát triển sự nghiệp:', '1. xây dựng hồ sơ cá nhân, cung cấp đầy đủ thông tin về tên tuổi, học vấn, cấp bậc làm việc,... để nhà tuyển dụng hiểu rõ, chi tiết hơn về bạn. đây là cách tạo thêm cho mình nhiều cơ hội việc làm trong tương lai.', '2. kết nối với nhà tuyển dụng, các doanh nghiệp trong và ngoài nước để từ đó có công việc ổn định, phù hợp khả năng của bản thân. phát triển sự nghiệp bản thân.', '3. các doanh nghiệp, tổ chức chia sẻ những cơ hội công việc của doanh nghiệp để tìm kiếm ứng viên tiềm năng và xây dựng thương hiệu của một nhà tuyển dụng chuyên nghiệp.']",66f79d3af050d8d70ad2499c,54
816,Châu Vĩnh Luân,Tiếng Trung đàm thoại theo chủ đề,2021-12-15,21,399000.0,699000.0,5.0,2,217,Ngoại Ngữ,"['cải thiện được vốn từ, ngữ pháp và kỹ năng nghe, nói phản xạ.', 'nắm bắt được cách dùng các cấu trúc bổ ngữ và các cấu trúc khác trong tiếng trung.', 'giúp ích cho bạn trong việc giao tiếp ở công ty, cuộc sống.']",66f79d3af050d8d70ad249a0,71
817,Ngọc Quỳnh Lê,Học sử dụng STUDIO ONE cơ bản - Phần mềm thu âm và làm nhạc mới,2022-02-19,41,299000.0,499000.0,4.5,4,205,Âm Nhạc,"['làm quen với phần mềm làm nhạc mới studio one.', 'thành thạo sử dụng các công cụ và nắm rõ kĩ thuật sử dụng phần mềm.']",66f79d3af050d8d70ad249a1,80
818,Vũ Ngọc Đăng,"Học thiết kế in lụa, in lưới",2021-12-15,30,399000.0,799000.0,5.0,4,297,Thiết Kế,"['trở thành nhân viên thiết kế phim in lưới, in lụa.', 'nắm vững thành thạo nghề vẽ phim in lụa, in lưới.', 'tách xuất phim thành thạo.', 'xử lý tram hóa.', 'kết hợp xuất các kiểu phim tram vector và ảnh bitmap.', 'sau khi học xong học viên có thể áp dụng vào công việc thiết thực của mình qua: làm việc tại các xưởng in lụa, in lưới hoặc làm tại các cơ sở photocopy phụ trách in ấn thậm chí mở xưởng in nhỏ cho riêng mình.']",66f79d3af050d8d70ad249a2,47
819,Nguyễn Thị Nhung,Nghệ thuật giữ lửa hạnh phúc,2022-06-20,34,399000.0,1999000.0,5.0,8,125,Hôn Nhân - Gia Đình,"['hiểu sự khác biệt giữa đàn ông và phụ nữ về cả tình yêu và tình dục, từ đó thấu hiểu người bạn đời và giải quyết các vấn đề trong đời sống hôn nhân.', 'hiểu và ứng dụng hiệu quả 5 giác quan cho cuộc “yêu” hoàn hảo.', 'hiểu được cơ chế cực khoái và áp dụng các bài tập cho vùng cơ sàn chậu giúp tăng khoái cảm trong “chuyện chăn gối”.', 'hiểu được các kiến thức cơ bản về chăm sóc vùng kín đúng cách và các biện pháp bảo vệ trong “cuộc yêu”.']",66f79d3af050d8d70ad249a3,32
820,Đặng Quang Vũ,Bí quyết ứng xử với những người khó chịu trong công ty của bạn,2021-12-15,25,399000.0,799000.0,5.0,5,101,Phát Triển Bản Thân,"['giúp cho các nhà quản lý, doanh nhân đạt được mục tiêu của giao tiếp - ứng xử là làm thay đổi nhận thức, thái độ và hành vi của nhân viên.', 'biết cách làm cho những người khó chịu hoà đồng nhận thức, cảm xúc với mình, hiểu được mình, trên cơ sở đó mà thay đổi nhận thức, thái độ và hành vi theo mục đích của mình.', 'có được những kỹ năng giao tiếp thiết yếu như điều chỉnh và định hướng trong giao tiếp, các kỹ năng ứng xử khéo léo: giảm thiểu sự khác biệt, lắng nghe để hiểu, hiểu người khó chịu sâu sắc và cách nói cho người khó chịu hiểu.']",66f79d3af050d8d70ad249a4,32
821,Đặng Quang Vũ,Bí quyết để nhận ra và phòng chống sự lừa dối,2021-12-15,23,399000.0,799000.0,5.0,3,168,Phát Triển Bản Thân,"['nhận biết sự dối trá qua việc quan sát ngôn ngữ cử chỉ.', 'hiểu được sự thật ẩn giấu trong các thông điệp.', 'có những kế hoạch cụ thể để phát hiện sự dối trá.', 'đảm bảo được tính trung thực trong các mối quan hệ.']",66f79d3af050d8d70ad249a5,52
822,Đặng Quang Vũ,Những luật bất thành văn trong kinh doanh mà bạn cần biết,2021-12-15,17,399000.0,799000.0,5.0,3,111,Kinh Doanh - Khởi Nghiệp,"['nắm được các quy tắc bất thành văn trong công việc và kinh doanh.', 'nâng cao khả năng thăng tiến và có quan hệ tốt hơn với đồng nghiệp.', 'nâng cao khả năng quản lý và hòa đồng với nhân viên cấp dưới.', 'tạo được sự tôn trọng của người khác, có được một môi trường làm việc thân thiện và hợp tác xung quanh bản thân.']",66f79d3af050d8d70ad249a6,97
823,Đặng Quang Vũ,Bí quyết để đột phá trong học tập,2021-12-15,16,399000.0,799000.0,5.0,4,97,Phát Triển Bản Thân,"['có được những lời khuyên bổ ích trong học tập.', 'rèn luyện tư duy và tác phong học tập đúng đắn.', 'trang bị những kỹ năng cần thiết trong cuộc sống và những phương pháp học tập hiệu quả.', 'biết cách tạo động lực cho bản thân để bạn có thể nhanh chóng bứt phá và vươn tới thành công']",66f79d3af050d8d70ad249a7,9
824,Đặng Thị Hương,"Mang thai mạnh khỏe, nuôi con dễ dàng",2021-12-15,22,399000.0,799000.0,5.0,2,126,Hôn Nhân - Gia Đình,"['trang bị kiến thức nền tảng cần thiết trong hành trình mang thai, sinh con và nuôi con khoa học.', 'biết được các phương pháp xử lý những tình huống phổ biến mà các mẹ hay gặp phải.', 'biết được các hiện tượng hay gặp ở trẻ nhỏ và cách xử lý.']",66f79d3af050d8d70ad249a8,85
825,Nguyễn Ngọc Dương,Học lập trình Game Scratch,2022-04-05,11,399000.0,699000.0,4.1,2,195,Lập Trình - CNTT,"['khơi dậy niềm đam mê công nghệ, sự sáng tạo của học viên.', 'ứng dụng công nghệ trong học tập và trong cuộc sống.', 'xây dựng nền tảng công nghệ 4.0 cho các bạn trẻ.']",66f79d3af050d8d70ad249a9,37
826,Đặng Thị Hương,Chia sẻ kiến thức về mang thai cho bà bầu,2021-12-15,20,399000.0,799000.0,5.0,3,125,Hôn Nhân - Gia Đình,"['trang bị kiến thức nền tảng cần thiết trong hành trình mang thai.', 'biết được các phương pháp xử lý những tình huống phổ biến mà các bà mẹ hay gặp phải.']",66f79d3af050d8d70ad249aa,65
827,Đặng Thị Hương,"Những vấn đề thường gặp của kinh nguyệt phụ nữ và cách phòng tránh, chữa trị",2021-12-15,15,399000.0,799000.0,5.0,3,99,Thể Thao - Sức Khỏe,"['biết được những kiến thức quan trọng và hữu ích về kinh nguyệt.', 'biết được dấu hiệu, biểu hiện bất thường của kinh nguyệt để kịp thời xử lý.', 'biết được những chứng bệnh của kinh nguyệt, cách phòng tránh và điều trị.', 'có được những kiến thức quan trọng và bổ ích trong thời kì kinh nguyệt có nhiều biến động là thời kỳ tiền mãn kinh.']",66f79d3af050d8d70ad249ab,38
828,Đặng Thị Hương,Tìm hiểu về kinh nguyệt và một số chứng bệnh thường gặp,2021-12-15,17,399000.0,799000.0,5.0,3,129,Thể Thao - Sức Khỏe,"['biết được những kiến thức quan trọng và hữu ích về kinh nguyệt và tuổi dậy thì.', 'biết được những vấn đề thường gặp liên quan đến kinh nguyệt.', 'biết được một số chứng bệnh thường gặp của kinh nguyệt.']",66f79d3af050d8d70ad249ac,68
829,Nguyễn Tuấn Anh,Xây dựng hệ thống chăm sóc khách hàng tự động,2021-12-15,22,399000.0,799000.0,5.0,1,113,Kinh Doanh - Khởi Nghiệp,"['+/ giúp gia tăng doanh số và đào tạo cho toàn bộ hệ thống kinh doanh của mình', '+/ quản lý hệ thống, quản lý khách hàng và chăm sóc khách hàng tự động', '+/ giúp bạn gia tăng doanh số, tuyển dụng hệ thống đại lý,ctv trên toàn quốc 1 cách dễ dàng và nhanh chóng', '+/ chăm sóc khách hàng tự động: phản hồi khách hàng mọi lúc, ngay khi khách hàng tương tác với trang của bạn', '+/ có thêm nhiều các mối quan hệ, gia tăng cơ hội hợp tác với những người top của việt nam', '+/ xây dựng mô hình kinh doanh với hệ thống data hàng nghìn khách hàng có sẵn', '+/ chăm sóc khách hàng, upsell, downsell và bán chéo bất kì sản phẩm nào mà bạn có', '+/ mở rộng quy mô và nhân rộng mô hình kinh doanh. giải quyết triệt để bài toán tìm kiếm khách hàng mới và phụ thuộc vào các kênh quảng cáo']",66f79d3af050d8d70ad249ad,76
830,Ngô Dũng Tuấn,Nuôi con không lạm dụng kháng sinh,2021-12-15,19,399000.0,799000.0,5.0,6,103,Hôn Nhân - Gia Đình,"['giúp các bậc cha mẹ hiểu rõ hơn về ảnh hưởng của thuốc kháng sinh đến sức khỏe của con trẻ.', 'cách chăm sóc sức khỏe cho trẻ thật tốt khi đau ốm mà không quá dựa dẫm vào thuốc kháng sinh.']",66f79d3af050d8d70ad249ae,80
