Unnamed: 0,Author,Coursename,Last_updated,Lectures,Newfee,Oldfee,Rating,Sections,Time,Topic,Target,_id,Number_of_enroll
1115,Nguyễn Ngọc Tiệp,Chinh phục 60/60 nghe hiểu JLPT N3,2022-05-29,32,299000.0,599000.0,5.0,3,588,Ngoại Ngữ,"['sau khóa học này:', 'học viên có thể tự tin nghe hơn, giao tiếp tốt hơn, hiểu sâu hơn về nghe hiểu, giao tiếp tiếng nhật và đặc biệt và có thể tự tin vào phòng thi jlpt.', 'trong đời sống và trong công việc: khóa học nghe hiểu giúp bạn có thể có kĩ năng nghe hiểu thực chiến, khả năng trả lời, đối đáp hội thoại tự tin hơn rất nhiều.']",66f79d3af050d8d70ad24acb,5
1116,Bùi Quốc Kỳ,Chuyên gia mạng quốc tế CCNA Routing and Switching,2022-04-24,142,299000.0,599000.0,4.2,25,850,Lập Trình - CNTT,"['bám sát giáo trình đào tạo chuyên gia mạng quốc tế của học viện cisco.', 'hiểu được tổng quan về mạng máy tính, mạng không dây từ cơ bản đến nâng cao.', 'hiểu cơ chế trao đổi dữ liệu giữa các thiết bị mạng.', 'cơ chế hoạt động của các giao thức mạng.', 'phương thức hoạt động các kỹ thuật, công nghệ sử dụng trên mạng lan, wan.', 'phân tích cơ chế hoạt động của các phương thức tấn công mạng và giải pháp phòng chống.']",66f79d3af050d8d70ad24acc,5
1117,Nguyễn Đức Việt,Học lập trình React js và Redux qua bài tập thực hành,2022-02-19,170,399000.0,699000.0,4.4,59,1313,Lập Trình - CNTT,"['với khoá học này bạn sẽ:', 'nắm được kiến thức bài bản từ đầu về thư viện javascript nổi tiếng phát triển bởi facebook - react js.', 'nắm được logic hoạt động, các khái niệm, cách thao tác, lập trình chức năng và cách kết hợp redux và react js.', 'học từ đầu về cách thao tác với cơ sở dữ liệu postgresql.', 'hiểu cách xử lý router trong lập trình react js.', 'học cách tích hợp react js với localstorage.', 'học cách tích hợp react js với firebase.', 'lập trình node js với cơ sở dữ liệu postgresql.', 'đưa bạn từng bước đi từ chưa biết gì cho đến lúc bạn có thể tự tin apply vào các công ty lập trình react.', 'khóa học sẽ giúp bạn có thể thiết kế những trang web dựa trên nền tảng react một cách chuyên nghiệp nhất.', 'hoàn tất khóa học, bạn có thể apply vào các công ty lập trình web có yêu cầu react với ""profile cá nhân của bạn có react js là headhunt sẽ gọi tới bạn liên tục""!', 'khóa học sẽ giúp bạn lập trình node js với vai trò api, và react js với vai trò frontend thông qua một ứng dụng fullstack javascript.']",66f79d3af050d8d70ad24acd,43
1118,Lê Yến Hoa,DẠY CON TỪ TIỀM THỨC,2021-12-15,18,399000.0,699000.0,5.0,2,156,Hôn Nhân - Gia Đình,"['nếu không học:', 'học viên không bao giờ biết hành vi thái độ của con có nguồn gốc từ lời nói và thái độ của mình. khi đó phụ huynh sẽ tìm cách đổ lỗi cho gen tính cách, hoặc môi trường bạn bè, thầy cô giáo... hoặc một yếu tố khác.', 'ngay khi học khóa học này:', 'phụ huynh có thể áp dụng mẫu ngôn ngữ đúng với con, bất chấp mọi hoàn cảnh khác tác động vào con, mà vẫn đạt được kết quả hỗ trợ cho con thay đổi tích cực như mong muốn.', 'khi học nên có tai nghe cho chồng/vợ học cùng để cùng thực hiện mẫu ngôn ngữ đúng cho con.', 'về lâu dài, kiến thức này áp dụng cho mọi lĩnh vực trong cuộc sống khi ta muốn dùng các mẫu ngôn ngữ này để giúp đỡ bất cứ ai có sự thay đổi tốt lên hoặc ảnh hưởng tích cực để sự phát triển của họ. áp dụng mẫu này lâu dài, con bạn sẽ trưởng thành hạnh phúc và thành công, rất yêu và gắn kết bố mẹ, gia đình. ngoài ra con cũng sẽ có gia đình riêng hạnh phúc và biết cách dạy các con của con. đây mới là tài sản lớn nhất mà cha mẹ để lại cho con cháu: các mẫu ngôn ngữ đầy tình yêu và hiệu quả.']",66f79d3af050d8d70ad24ace,89
1119,Trần Phương Nga,"Khóa học rau câu 3D ""Nét đẹp truyền thống của bộ tranh tứ quý""",2021-12-15,32,399000.0,699000.0,5.0,2,276,Nghệ Thuật - Đời Sống,"['học viên tạo hình được những mẫu thạch bắt mắt, ngon miệng phù hợp để trang trí, làm quà tặng hoặc thưởng thức trong những ngày trời nắng nóng.']",66f79d3af050d8d70ad24acf,44
1120,Vũ Văn Bình,PHƯƠNG PHÁP HUẤN LUYỆN GIỌNG NÓI SIÊU TỐC,2022-04-07,25,399000.0,699000.0,5.0,3,226,Phát Triển Bản Thân,"['trước khi học “nói hay”, các bạn phải biết “nói đúng”. “ngọng” – đó là lỗi phổ biến nhất trong phát âm của rất nhiều người, không chỉ những lỗi dễ phát hiện như “l”, “n” mà còn nhiều âm khác mà chính bạn cũng không nhận ra như: “e”, “o”...', '“biết mình biết ta” – nhận ra được những nhược điểm trong giọng nói của chính mình cũng là điểm mấu chốt trong quá trình luyện giọng của bạn.', 'từ đó, chúng ta mới có thể biết cách điều chỉnh âm điệu giọng nói sao cho hay nhất, truyền cảm nhất.', 'ngoài ra, bạn sẽ còn được hướng dẫn cách luyện tập hàng ngày sao cho có được giọng nói khỏe mạnh, trong trẻo và không bị hụt hơi nữa đó.', 'thêm vào đó là học viên sẽ làm chủ được hơi thở, nhịp điệu ngưng nghỉ để có thể tự tin khi đứng trước đám đông, và tự mình tạo ra các file sản phẩm kĩ thuật số, file sản phẩm audio, video với phong cách của 1 người phát thanh chuyên nghiệp.']",66f79d3af050d8d70ad24ad0,49
1121,Đỗ Thị Ngọc Ánh,Học và chơi cùng Tiếng Anh qua các bài hát,2021-12-15,14,399000.0,699000.0,5.0,1,135,Ngoại Ngữ,"['sau khóa học, học sinh sẽ học được hơn 1000 câu từ một cách tự nhiên.', 'âm nhạc, nhịp điệu và cảm xúc của chính các bài hát sẽ giúp học sinh ghi nhớ những từ ngữ tiếng anh một cách dễ dàng nhất.', 'không những thế, những bài hát tiếng anh còn như những thần dược giúp học sinh bé vui vẻ, tự tin và trưởng thành mỗi ngày.']",66f79d3af050d8d70ad24ad1,57
1122,Nguyễn Văn Thiết,Tính toán và ảo tính Soroban cho phụ huynh dạy bé 3 đến 8 tuổi,2022-04-09,29,399000.0,799000.0,5.0,2,176,Hôn Nhân - Gia Đình,"['phụ huynh giúp bé cộng trong phạm vi 10 một cách chính xác và thuần thục.', 'trẻ em đạt được sự tập trung trí óc.', 'trẻ em rèn luyện trí nhớ.', 'trẻ em phát triển bán cầu não phải.', 'các bé nâng cao khả năng tính toán.']",66f79d3af050d8d70ad24ad2,81
1123,Đỗ Gia Trân,DETOX TỔNG HỢP - ĐẸP DA - GIẢM CÂN - THANH LỌC CƠ THỂ,2022-05-20,37,399000.0,699000.0,5.0,7,191,Nghệ Thuật - Đời Sống,"['kết hợp với việc vận động, tập luyện điều độ sẽ giúp bạn đẹp tự nhiên và thon gọn hơn sau một tuần trải nghiệm.', 'cơ thể được “làm sạch”các chất bẩn sẽ giảm đáng kể, làn da như được thay mới, bên cạnh đó còn tạo cảm giác thoải mái, khoan khoái giúp bạn làm việc và học tập hiệu quả hơn hẳn.', 'công thức mới lạ tạo ra thức uống độc đáo.', 'sau khóa học, bạn luôn có thể hỏi giảng viên khi có thắc mắc bất kỳ lúc nào.', 'bạn có đủ kiến thức và thao tác chuyên nghiệp để làm hoặc kinh doanh được ngay sau khóa học.', 'thức uống đang hot và không bị lỗi thời, do nhu cầu làm đẹp & giảm cân của phái đẹp luôn không ngừng.', 'có thể tự sáng tạo thêm nhiều loại thức uống khác nhau.']",66f79d3af050d8d70ad24ad3,12
1124,Henry Khánh,"Kiếm thêm trăm triệu mỗi tháng bằng nghề tay trái, 3 tháng hái quả ngọt",2022-03-11,29,399000.0,699000.0,4.3,4,159,Kinh Doanh - Khởi Nghiệp,"['sau khóa học, học viên sẽ trở thành những người rất đa năng và tự tin trong cuộc sống, với 3-4 nguồn thu nhập khác nhau, thể hiện ngay sau khi học trong khoảng 3 - 4 tháng.', 'những kinh nghiệm thực tế và những bí quyết làm nghề, được chia sẻ một cách rõ ràng, sẽ giúp các học viên kiếm thêm thu nhập một cách chắc chắn. ít thì cũng tăng thêm hai ba chục triệu một tháng. nhiều thì vài trăm triệu mỗi tháng.', 'sau khi áp dụng những kiến thức này, về lâu dài, nếu làm theo những kỹ năng kiến thức trong khóa học thì người học sẽ đạt được những thành công rực rỡ trong nghề môi giới bất động sản, kinh doanh online hay kinh doanh du lịch mà hoàn toàn không phải rời bỏ công việc của mình. học viên vẫn có công việc ổn định và nhiều luồng thu nhập thêm từ những nghề part-time.', 'sau khi có kinh nghiệm và “thiên thời, địa lợi, nhân hòa”, học viên có thể hoàn toàn tự mở công ty sau này, để vươn tới giấc mơ ""tự do tài chính"" và thoát khỏi kiếp làm thuê.']",66f79d3af050d8d70ad24ad4,13
1125,Trần Minh Phượng,Cake popsicle - món quà ngọt ngào nhân ngày Tết thiếu nhi.,2021-12-15,28,399000.0,699000.0,5.0,2,250,Nghệ Thuật - Đời Sống,"['học viên tạo hình được những mẫu cake popsicle siêu đặc biệt, siêu đáng yêu nhưng lại vô cùng dễ thực hiện cũng như chuẩn bị nguyên liệu.']",66f79d3af050d8d70ad24ad5,41
1126,Phạm Văn Học,Thực hành lập báo cáo tài chính trên Excel theo cách đơn giản nhất dành cho người chưa có kinh nghiệm,2022-03-23,27,299000.0,599000.0,5.0,4,314,Tin Học Văn Phòng,"['hiểu được quy trình lập các báo cáo trong bộ báo cáo tài chính.', 'tự tay lập được báo cáo tài chính một cách đơn giản và dễ dàng nhất.', 'biết kiểm tra lại kết quả cuối cùng của các báo cáo đã chính xác chưa.']",66f79d3af050d8d70ad24ad6,94
1127,Cao Thị Thúy Nga,Nắm tiếng Anh không cần học thuộc lòng,2022-05-29,47,299000.0,599000.0,4.0,5,181,Ngoại Ngữ,"['sau khóa học, học viên có được lượng kiến thức tổng hợp cơ bản về 4 kĩ năng nền tảng tiếng anh cùng những phương pháp học tập tiếp theo rất linh hoạt và phù hợp.', 'về lâu dài, người học có thể áp dụng những phương pháp học và lượng kiến thức này như nòng cốt để tiếp tục học nâng cao, đặc biệt là hỗ trợ rất tốt cho khả năng tự học.', 'tiết kiệm thời gian, tiết kiệm tiền bạc vì không phải học nhiều khóa học không hiệu quả, đặc biệt nhanh chóng tìm được cách học mới đầy hứng thú và hiệu quả.', 'nền tảng tiếng anh sẽ được ghi nhớ mà khỏi lo bị quên.', 'rèn luyện sự yêu thích việc học tiếng anh cũng như có được cách học các ngoại ngữ khác sau này.']",66f79d3af050d8d70ad24ad7,72
1128,Hoàng Quốc Hưng,Quản trị chiến lược - La bàn dẫn lối doanh nghiệp,2022-05-29,17,299000.0,599000.0,3.9,2,154,Kinh Doanh - Khởi Nghiệp,"['hiểu được bản chất của quản trị chiến lược và vai trò dẫn dắt của ceo, của người đứng đầu trong doanh nghiệp.', 'nắm được các yếu tố quan trọng nhất của việc vẽ ra một chiến lược phù hợp, khả thi và biết truyền tải chiến lược đó đến toàn thể anh chị em nhân viên trong công ty để đồng lòng đưa doanh nghiệp hoạt động một cách trơn tru và phát triển bền vững.']",66f79d3af050d8d70ad24ad8,17
1129,Phạm Nguyên Khôi,7 bước thiết kế UX,2022-05-31,38,299000.0,599000.0,3.6,8,271,Thiết Kế,"['những khái niệm cơ bản về ux và thiết kế ux, lợi ích của thiết kế ux và khoá học này. quy trình thiết kế ux bao gồm 7 bước:', '1. lập plan - xác định mục tiêu, business needs & user needs.', '2. discover - thực hiện research trên khách hàng bằng interview, observation, card sorting và survey.', '3. explorer - vẽ wireframe trên giấy.', '4. define - vẽ digital wireframe bằng phần mềm.', '5. design - thêm vào màu sắc, hình ảnh, typographic...', '6. test lại design trên người dùng.', '7. chuyển giao thiết kế cho developer.', 'đồng thời học các công cụ và phương thức để thực hiện trên mỗi bước.']",66f79d3af050d8d70ad24ad9,29
1130,Đỗ Đức Duy,Khóa học đồ uống truyền thống,2022-05-29,15,299000.0,599000.0,5.0,2,98,Nghệ Thuật - Đời Sống,"['sau khoá học, bạn sẽ có được những gì:', 'trải qua thời gian khởi nghiệp khó khăn nhất.', 'nắm được các bí quyết cốt lõi trong đồ uống để kinh doanh phù hợp.', 'biết được những nguồn nguyên liệu tốt, với giá thành rẻ hơn thị trường chung.', 'sau một cửa hàng kinh doanh có lãi, sẽ là chuỗi cửa hàng của bạn mọc ra liên tiếp.']",66f79d3af050d8d70ad24ada,85
1131,Nguyễn Đình Minh,Business Model trong kinh doanh,2022-05-08,33,299000.0,549000.0,4.0,3,129,Kinh Doanh - Khởi Nghiệp,"['hiểu được tổng quan về 9 biến trong mô hình kinh doanh.', 'nắm được các yếu tố quan trọng nhất của việc vẽ ra một mô hình kinh doanh khả thi và biết cách thử nghiệm để tìm ra mô hình phù hợp cho ý tưởng kinh doanh của mình.', 'hiểu sâu sắc về tầm quan trọng của một mô hình kinh doanh hoàn thiện để biến ý tưởng trở thành hiện thực.', 'biết được 5 bước vận hành một mô hình kinh doanh, biết cách là đánh giá ý tưởng kinh doanh có khả thi hay không và biết cách làm thế nào để mở rộng hoạt động kinh doanh của mình.']",66f79d3af050d8d70ad24adb,37
1132,Balance,Nhân Tướng Tình Tiền Tài Tật,2022-05-29,15,299000.0,599000.0,4.0,8,90,Nghệ Thuật - Đời Sống,"['người học đạt được mục tiêu:', 'dự đoán được tình, tiền, tài, tật của bản thân và các mối quan hệ cần thiết.', 'có được bí kíp xem tướng đơn giản, căn bản, phổ thông cho đa số.', 'có được bí quyết chọn người, tăng phúc đức, giảm tật ách.', 'có được công thức rèn luyện tâm tướng.']",66f79d3af050d8d70ad24adc,59
1133,Bùi Quang Cường,70 bí kíp quảng cáo Google Adwords,2024-08-19,70,399000.0,899000.0,5.0,9,436,Marketing,"['thấu hiểu và biết cách tránh những sai lầm chết người khi chạy google ads.', 'tự tay đưa quảng cáo lên top google ngay trong khoá học.', 'biết cách tối ưu quảng cáo, nâng cao điểm chất lượng để chi phí đầu tư ít hơn đối thủ cạnh tranh.', 'cách thức đo lường hiệu quả của chiến dịch google ads.', 'hướng dẫn tạo chiến dịch quảng cáo google ads chuẩn quốc tế.', 'tận dụng được tệp data khách hàng tiềm năng của nhiều dự án khác nhau để tối ưu chi phí.', 'tiết kiệm được từ 10-50% ngân sách marketing dành cho google.', 'loại trừ click ảo, click tặc trong quảng cáo google ads.']",66f79d3af050d8d70ad24add,34
1134,Hannah Phạm,Trọn bộ ngữ pháp tiếng Anh ứng dụng,2024-08-16,129,399000.0,699000.0,4.4,6,1204,Ngoại Ngữ,"['giúp người học hệ thống hóa toàn bộ kiến thức ngữ pháp tiếng anh phục vụ cho việc giao tiếp, thi tốt nghiệp, đại học, thi lấy chứng chỉ toeic/ielts.']",66f79d3af050d8d70ad24ade,24
1135,Trần Duy Thanh,Học lập trình Java trong 4 tuần,2022-06-01,89,299000.0,549000.0,4.6,11,1107,Lập Trình - CNTT,"['có được kiến thức toàn diện về ngôn ngữ lập trình java.', 'có khả năng tiếp cận lập trình android.']",66f79d3af050d8d70ad24adf,61
1136,Vũ Tiến Thành,Làm chủ cách thiết kế video hoạt họa trong 2 giờ,2021-12-15,20,399000.0,799000.0,5.0,5,127,Thiết Kế,"['học viên làm chủ được công cụ và cách thức để thiết kế video hoạt họa. từ đó, học viên sẽ tạo ra được các video bài giảng để dạy cho học sinh, video xây dựng thương hiệu cho tổ chức hoặc cá nhân.', 'làm các video hay để phát triển kênh youtube.']",66f79d3af050d8d70ad24ae0,31
1137,Nguyễn Phi Long,Phương pháp chọn Crypto tốt để đầu tư,2022-03-31,28,399000.0,999000.0,4.3,4,288,Đầu Tư,"['học viên nắm được kiến thức nền tảng.', 'lựa chọn cách đầu tư phù hợp nhất cho mình.', 'đón được cơ hội đầu tư của những đồng crypto tăng trưởng tốt', 'hạn chế tối đa rủi ro đầu tư bằng phương pháp quản lý phân bổ vốn.', 'biết bắt đầu từ đâu, mình cần phải làm gì.', 'trở thành người đầu tư thông minh.']",66f79d3af050d8d70ad24ae1,44
1138,Trần Duy Thanh,Lập trình Java nâng cao,2022-05-23,61,399000.0,699000.0,4.8,8,208,Lập Trình - CNTT,"['có được kiến thức toàn diện về ngôn ngữ lập trình java.', 'có thể lập trình quản lý cơ sở dữ liệu.', 'viết được phần mềm quản lý (liên quan đến cơ sở dữ liệu) cho khách hàng.', 'dễ dàng tiến tới lập trình trên android.']",66f79d3af050d8d70ad24ae2,29
1139,Phạm Thị Thùy Dung,Email Marketing - Tăng Sale Và Xây Dựng Thương Hiệu Với Chi Phí 0 Đồng,2022-05-29,25,299000.0,599000.0,4.0,3,135,Marketing,"['hiểu được tổng quan về chiến dịch email marketing.', 'nắm được các yếu tố quan trọng nhất của email marketing nói chung và nội dung của một email hấp dẫn nói riêng.', 'hiểu sâu sắc các phương pháp quan trọng trong thực hiện làm ra 1 email gửi đến khách hàng.', 'biết được quy trình nghiên cứu khách hàng cũng như các yếu tố tâm lý, nhu cầu cơ bản của người tiêu dùng để áp dụng vào sử dụng email hiệu quả với chi phí cực thấp.']",66f79d3af050d8d70ad24ae3,43
1140,Đỗ Văn Trà,Kế toán xây dựng,2022-05-09,18,299000.0,599000.0,4.1,6,182,Kiến Thức Chuyên Ngành,"['học viên có được kiến thức thực tế, phân tích đa chiều, chuyên sâu trong lĩnh vực xây dựng, xây lắp của doanh nghiệp và chủ đầu tư trên cơ sở các tình huống, phân tích thực tế tại doanh nghiệp từ kế toán, tài chính - tín dụng, thuế và quản trị doanh nghiệp theo mục tiêu tùy giai đoạn phát triển và yêu cầu quản lý.', 'nắm bắt kiến thức về hoạt động xây lắp ,xây dựng (hợp đồng xây lắp, xây dựng các bên a-b, đấu thầu, bảo lãnh, tạm ứng, thanh toán, quyết toán công trình ... và kế toán về hoạt động xây lắp, xây dựng và kế toán về mọi hoạt động tại một doanh nghiệp xây dựng, xây lắp tự thi công, giao thầu phụ ...).', 'hiểu và có kỹ năng tốt từ chi tiết đến tổng hợp về tổ chức công tác kế toán trong doanh nghiệp xây lắp, xây dựng công trình một cách hiệu quả nhất (tổ chức công tác kế toán, chứng từ kế toán, sổ sách kế toán, tk kế toán, hạch toán kế toán, lập bctc, quyết toán thuế gtgt và thuế tndn,...trong doanh nghiệp xây dựng ,xây lắp một cách thuần thục)', 'hiểu mối quan hệ giữa kế toán và hoạt động xây dựng, lắp đặt máy móc, thiết bị, biết xây dựng hệ thống quản trị thông tin kế toán theo mục tiêu phục vụ cho công tác quản lý, điều hành một doanh nghiệp xây lắp,xây dựng có hiệu quả nhất.', 'biết cách lập kế hoạch tài chính - kế toán và quản lý thực hiện kế hoạch theo thời gian và mục tiêu. trong đó nhấn mạnh đến các chỉ tiêu quan tâm hàng đầu của các đối tượng mà thông tin kế toán cung cấp : cơ quan thuế, nhà tài trợ vốn, cơ quan nhà nước có thẩm quyền ( hợp đồng ppp), cổ đông....', 'biết cách sử dụng tư vấn pháp luật về lĩnh vực xây lắp, xây dựng như : tư vấn thuế, kế toán, nhà tài trợ vốn, hình thức quản lý...và các luật có liên quan trong mọi hoạt động của một doanh nghiệp xây lắp, xây dựng nhằm hạn chế thấp nhất rủi ro mang lại lợi ích cao nhất cho doanh nghiệp.', 'áp dụng, liên hệ ngay được vào các công việc hiện tại, xây dựng bộ máy kế toán, thông tin kế toán, quản trị đáp ứng theo mục tiêu, định hướng và đặc điểm riêng của từng doanh nghiệp.', 'giúp học viên có định hướng đúng về tư duy, đối tượng nghiên cứu hướng tới sự chuyên nghiệp, nâng cao tầm nhìn, các vị trí quản lý, lãnh đạo tài chính- kế toán trong doanh nghiệp.']",66f79d3af050d8d70ad24ae4,54
1141,Thạc sĩ Nguyễn Phương Anh,Chinh phục tiếng Trung thật đơn giản,2022-05-29,46,299000.0,599000.0,4.0,15,300,Ngoại Ngữ,"['tự tin giao tiếp khi gặp người trung quốc ở bất cứ đâu.', 'cơ hội việc làm trong các doanh nghiệp trung quốc.', 'là nền tảng tốt cho những học sinh có nhu cầu đi sang trung quốc du học, công tác hoặc du lịch.']",66f79d3af050d8d70ad24ae5,63
1142,Tô Văn Hoan,Quảng cáo Google Adwords từ A-Z,2022-06-29,16,299000.0,499000.0,3.9,6,123,Marketing,"['sử dụng thành thạo kênh google adwords.', 'tiết kiệm (tối ưu) ít nhất 20 - 30% so với tự nghiên cứu và tìm hiểu chạy adwords.', 'nền tảng cơ bản cho người muốn làm tổng thể marketing trong tương lai.']",66f79d3af050d8d70ad24ae6,18
1143,Ms. Linh Vũ (Vũ Thùy Linh),Luyện phản xạ giao tiếp (phần 1),2022-05-10,27,399000.0,899000.0,5.0,3,674,Ngoại Ngữ,"['sau khi tham gia khóa học bạn sẽ:', 'nắm được vốn từ vựng thông dụng nhất dùng nhiều trong văn nói và giao tiếp hàng ngày.', 'có phản xạ giao tiếp tiếng anh tốt (ghép âm vào từ vựng và ngữ pháp). trong quá trình học bạn được thực hành nghe nói và tương tác liên tục với giảng viên trong bài học.', 'cải thiện kỹ năng nghe.', 'nắm được kỹ năng làm đề thi toeic phần 1.']",66f79d3af050d8d70ad24ae7,52
1144,Adam Tâm,Bán hàng online từ A đến Z,2022-06-28,47,699000.0,699000.0,4.1,9,388,Kinh Doanh - Khởi Nghiệp,"['hiểu được lý do tại nhiều người kinh doanh online thất bại.', 'tự mình nhập được hàng từ các kho lớn ở trung quốc với giá rẻ.', 'biết cách để viết một bài quảng cáo thu hút, nâng cao doanh thu.', 'làm chủ công cụ quảng cáo facebook và các kinh nghiệm được truyền đạt để ứng dụng thực tế vào việc bán hàng online tạo doanh số khủng.', 'nắm rõ quy trình bán hàng online thành công.', 'nắm rõ được các tiêu chí và chọn được sản phẩm phù hợp để bán hàng online.', 'biết cách bán hàng qua các công cụ sẵn có mà không cần chạy quảng cáo.', 'tối ưu bộ máy bán hàng online của chính mình và gia tăng lợi nhuận.']",66f79d3af050d8d70ad24ae8,68
1145,Ms. Linh Vũ (Vũ Thùy Linh),Luyện nghe nói tiếng Anh theo CNN,2022-03-24,20,399000.0,1500000.0,4.4,3,421,Ngoại Ngữ,"['khi tham gia khóa học bạn sẽ:', 'nắm được cách dùng của từ vựng và ngữ pháp từ cơ bản tới nâng cao trong các ngữ cảnh cụ thể và văn nói hàng ngày.', 'được luyện nghe giọng anh - mỹ chuẩn 100% trên bản tin cnn để tăng ngay lập tức khả năng nghe.', 'được thực hành nói đi nói lại cách phát âm chuẩn, hiểu rõ chỗ nối âm, ngữ điệu... trong câu giúp bạn nói tiếng anh chuẩn và lôi cuốn hơn.', 'có khả năng tự tin nói tiếng anh trước người khác, có thể thuyết trình bằng tiếng anh về các chủ đề đa dạng, tin tức thời sự hàng ngày.', 'đem lại cho bạn một vốn kiến thức khá lớn cũng như những chủ đề thú vị để bạn thỏa sức luyện tập tiếng anh.']",66f79d3af050d8d70ad24ae9,63
